{
  "schema_version": "1.0",
  "data_version": "2026-08-24",
  "generated_from_foods_table_version": "references/foods-table.md（per 100g 可食部）",
  "updated_at": "2026-08-24",
  "options": [
    {
      "adjustment_id": "protein_low_fat_shrimp_30g",
      "ingredient_id": "虾",
      "display_name": "虾",
      "adjustment_action": "increase",
      "increment_value": 30,
      "increment_unit": "g",
      "nutrition_delta": {
        "energy_kcal": 29.1,
        "protein_g": 6.2,
        "net_carbs_g": 0.1,
        "fat_g": 0.4
      },
      "suitable_meals": [
        "lunch",
        "dinner"
      ],
      "source_scope": [
        "locked_basket",
        "inventory"
      ],
      "mode_tags": [
        "balanced",
        "keto",
        "hormone_balance"
      ],
      "goal_tags": [
        "weight_loss",
        "maintain"
      ],
      "restriction_tags": [],
      "max_steps_per_day": 2,
      "max_total_change": 60,
      "package_impact": "none",
      "meal_structure_impact": "compatible",
      "requires_recipe_change": false,
      "requires_user_confirmation": false,
      "priority": 90,
      "enabled": true,
      "version": "1.0"
    },
    {
      "adjustment_id": "protein_low_fat_chicken_breast_30g",
      "ingredient_id": "鸡胸肉",
      "display_name": "鸡胸肉",
      "adjustment_action": "increase",
      "increment_value": 30,
      "increment_unit": "g",
      "nutrition_delta": {
        "energy_kcal": 33.0,
        "protein_g": 7.0,
        "net_carbs_g": 0.0,
        "fat_g": 0.4
      },
      "suitable_meals": [
        "lunch",
        "dinner"
      ],
      "source_scope": [
        "locked_basket",
        "inventory"
      ],
      "mode_tags": [
        "balanced",
        "keto",
        "hormone_balance"
      ],
      "goal_tags": [
        "weight_loss",
        "maintain",
        "muscle_gain"
      ],
      "restriction_tags": [],
      "max_steps_per_day": 2,
      "max_total_change": 60,
      "package_impact": "none",
      "meal_structure_impact": "compatible",
      "requires_recipe_change": false,
      "requires_user_confirmation": false,
      "priority": 88,
      "enabled": true,
      "version": "1.0"
    },
    {
      "adjustment_id": "protein_low_fat_cod_50g",
      "ingredient_id": "鳕鱼",
      "display_name": "鳕鱼",
      "adjustment_action": "increase",
      "increment_value": 50,
      "increment_unit": "g",
      "nutrition_delta": {
        "energy_kcal": 38.0,
        "protein_g": 8.9,
        "net_carbs_g": 0.0,
        "fat_g": 0.2
      },
      "suitable_meals": [
        "lunch",
        "dinner"
      ],
      "source_scope": [
        "locked_basket",
        "approved_substitution"
      ],
      "mode_tags": [
        "balanced",
        "keto",
        "hormone_balance"
      ],
      "goal_tags": [
        "weight_loss",
        "maintain"
      ],
      "restriction_tags": [],
      "max_steps_per_day": 1,
      "max_total_change": 50,
      "package_impact": "none",
      "meal_structure_impact": "compatible",
      "requires_recipe_change": false,
      "requires_user_confirmation": false,
      "priority": 82,
      "enabled": true,
      "version": "1.0"
    },
    {
      "adjustment_id": "protein_energy_egg_50g",
      "ingredient_id": "鸡蛋（全蛋）",
      "display_name": "鸡蛋（全蛋）",
      "adjustment_action": "increase",
      "increment_value": 50,
      "increment_unit": "g",
      "nutrition_delta": {
        "energy_kcal": 75.0,
        "protein_g": 6.3,
        "net_carbs_g": 0.6,
        "fat_g": 5.0
      },
      "suitable_meals": [
        "breakfast",
        "lunch",
        "dinner"
      ],
      "source_scope": [
        "locked_basket",
        "inventory"
      ],
      "mode_tags": [
        "balanced",
        "keto",
        "hormone_balance"
      ],
      "goal_tags": [
        "weight_loss",
        "maintain",
        "muscle_gain"
      ],
      "restriction_tags": [],
      "max_steps_per_day": 2,
      "max_total_change": 100,
      "package_impact": "none",
      "meal_structure_impact": "compatible",
      "requires_recipe_change": false,
      "requires_user_confirmation": false,
      "priority": 92,
      "enabled": true,
      "version": "1.0"
    },
    {
      "adjustment_id": "protein_energy_beidoufu_100g",
      "ingredient_id": "北豆腐",
      "display_name": "北豆腐",
      "adjustment_action": "increase",
      "increment_value": 100,
      "increment_unit": "g",
      "nutrition_delta": {
        "energy_kcal": 99.0,
        "protein_g": 9.2,
        "net_carbs_g": 3.5,
        "fat_g": 5.2
      },
      "suitable_meals": [
        "lunch",
        "dinner"
      ],
      "source_scope": [
        "locked_basket",
        "inventory"
      ],
      "mode_tags": [
        "balanced",
        "keto",
        "hormone_balance"
      ],
      "goal_tags": [
        "weight_loss",
        "maintain"
      ],
      "restriction_tags": [],
      "max_steps_per_day": 1,
      "max_total_change": 100,
      "package_impact": "improves",
      "meal_structure_impact": "compatible",
      "requires_recipe_change": false,
      "requires_user_confirmation": false,
      "priority": 85,
      "enabled": true,
      "version": "1.0"
    },
    {
      "adjustment_id": "protein_energy_greek_yogurt_100g",
      "ingredient_id": "无糖希腊酸奶",
      "display_name": "无糖希腊酸奶",
      "adjustment_action": "increase",
      "increment_value": 100,
      "increment_unit": "g",
      "nutrition_delta": {
        "energy_kcal": 88.0,
        "protein_g": 9.0,
        "net_carbs_g": 3.8,
        "fat_g": 4.2
      },
      "suitable_meals": [
        "breakfast",
        "snack"
      ],
      "source_scope": [
        "locked_basket",
        "inventory"
      ],
      "mode_tags": [
        "balanced",
        "hormone_balance"
      ],
      "goal_tags": [
        "weight_loss",
        "maintain"
      ],
      "restriction_tags": [],
      "max_steps_per_day": 1,
      "max_total_change": 100,
      "package_impact": "none",
      "meal_structure_impact": "compatible",
      "requires_recipe_change": false,
      "requires_user_confirmation": false,
      "priority": 80,
      "enabled": true,
      "version": "1.0"
    },
    {
      "adjustment_id": "protein_energy_milk_250ml",
      "ingredient_id": "全脂牛奶",
      "display_name": "全脂牛奶",
      "adjustment_action": "increase",
      "increment_value": 250,
      "increment_unit": "g",
      "nutrition_delta": {
        "energy_kcal": 162.5,
        "protein_g": 8.2,
        "net_carbs_g": 12.2,
        "fat_g": 9.0
      },
      "suitable_meals": [
        "breakfast"
      ],
      "source_scope": [
        "locked_basket",
        "inventory"
      ],
      "mode_tags": [
        "balanced",
        "hormone_balance"
      ],
      "goal_tags": [
        "maintain",
        "muscle_gain"
      ],
      "restriction_tags": [],
      "max_steps_per_day": 1,
      "max_total_change": 250,
      "package_impact": "none",
      "meal_structure_impact": "compatible",
      "requires_recipe_change": false,
      "requires_user_confirmation": false,
      "priority": 70,
      "enabled": true,
      "version": "1.0"
    },
    {
      "adjustment_id": "energy_carb_rice_50g",
      "ingredient_id": "白米饭（熟）",
      "display_name": "白米饭（熟）",
      "adjustment_action": "increase",
      "increment_value": 50,
      "increment_unit": "g",
      "nutrition_delta": {
        "energy_kcal": 58.0,
        "protein_g": 1.3,
        "net_carbs_g": 13.8,
        "fat_g": 0.1
      },
      "suitable_meals": [
        "lunch",
        "dinner"
      ],
      "source_scope": [
        "locked_basket",
        "inventory"
      ],
      "mode_tags": [
        "balanced",
        "hormone_balance"
      ],
      "goal_tags": [
        "maintain",
        "muscle_gain"
      ],
      "restriction_tags": [],
      "max_steps_per_day": 1,
      "max_total_change": 50,
      "package_impact": "none",
      "meal_structure_impact": "compatible",
      "requires_recipe_change": false,
      "requires_user_confirmation": false,
      "priority": 75,
      "enabled": true,
      "version": "1.0"
    },
    {
      "adjustment_id": "energy_carb_sweetpotato_100g",
      "ingredient_id": "红薯",
      "display_name": "红薯",
      "adjustment_action": "increase",
      "increment_value": 100,
      "increment_unit": "g",
      "nutrition_delta": {
        "energy_kcal": 90.0,
        "protein_g": 1.6,
        "net_carbs_g": 17.0,
        "fat_g": 0.2
      },
      "suitable_meals": [
        "breakfast",
        "lunch",
        "dinner"
      ],
      "source_scope": [
        "locked_basket",
        "inventory"
      ],
      "mode_tags": [
        "balanced",
        "hormone_balance"
      ],
      "goal_tags": [
        "maintain"
      ],
      "restriction_tags": [],
      "max_steps_per_day": 1,
      "max_total_change": 100,
      "package_impact": "none",
      "meal_structure_impact": "compatible",
      "requires_recipe_change": false,
      "requires_user_confirmation": false,
      "priority": 72,
      "enabled": true,
      "version": "1.0"
    },
    {
      "adjustment_id": "energy_carb_corn_50g",
      "ingredient_id": "鲜玉米",
      "display_name": "鲜玉米",
      "adjustment_action": "increase",
      "increment_value": 50,
      "increment_unit": "g",
      "nutrition_delta": {
        "energy_kcal": 48.0,
        "protein_g": 1.8,
        "net_carbs_g": 8.8,
        "fat_g": 0.6
      },
      "suitable_meals": [
        "breakfast",
        "lunch"
      ],
      "source_scope": [
        "locked_basket",
        "inventory"
      ],
      "mode_tags": [
        "balanced",
        "hormone_balance"
      ],
      "goal_tags": [
        "maintain"
      ],
      "restriction_tags": [],
      "max_steps_per_day": 1,
      "max_total_change": 50,
      "package_impact": "none",
      "meal_structure_impact": "compatible",
      "requires_recipe_change": false,